{
  "schema_version": "1.0",
  "contract_namespace": "glassity.inbound-envelope.v1",
  "envelope_id": "123e4567-e89b-42d3-a456-426614174003",
  "tenant_id": "tenant-alpha",
  "deployment_id": "deployment-alpha-eu-west-1",
  "envelope_type": "upload_pointer",
  "source": {
    "system": "object_storage",
    "object_id": "synthetic-vault-export",
    "version_id": "version-003",
    "content_sha256": "eeeeeeeeeeeeeeeeeeeeeeeeeeeeeeeeeeeeeeeeeeeeeeeeeeeeeeeeeeeeeeee",
    "resolver_ref": "urn:glassity:synthetic:object:vault-export:version-003",
    "owning_region_or_system": "eu-west-1"
  },
  "actor_service_id": "synthetic-inbound-adapter",
  "created_at": "2026-08-28T12:03:00Z",
  "provenance": {
    "date_status": "unknown",
    "reason": "The synthetic source carries no authoritative date."
  },
  "classification": "internal",
  "classification_policy_ref": "urn:glassity:synthetic:policy:classification",
  "idempotency_key": "ee74cbb0040841948e79f65c43e822f545996f851ac3272322b3c19ca7d7a167",
  "destination": "_inbox/123e4567-e89b-42d3-a456-426614174003.json"
}
