{
  "schema_version": "1.0",
  "contract_namespace": "glassity.inbound-envelope.v1",
  "envelope_id": "123e4567-e89b-42d3-a456-426614174002",
  "tenant_id": "tenant-alpha",
  "deployment_id": "deployment-alpha-eu-west-1",
  "envelope_type": "domain_event",
  "source": {
    "system": "event_store",
    "object_id": "synthetic-domain-event",
    "version_id": "event-version-001",
    "content_sha256": "cccccccccccccccccccccccccccccccccccccccccccccccccccccccccccccccc",
    "resolver_ref": "urn:glassity:synthetic:event:domain-event:event-version-001",
    "owning_region_or_system": "application-event-store"
  },
  "actor_service_id": "synthetic-event-adapter",
  "created_at": "2026-08-28T12:02:00Z",
  "provenance": {
    "date_status": "resolved",
    "source_date": "2026-08-28",
    "date_kind": "event"
  },
  "classification": "internal",
  "classification_policy_ref": "policies/synthetic-retention-v1",
  "idempotency_key": "fcf30ab7b51955eeb37e634668a29e6eb69e44b8140caeacbe1412c0bdf8488a",
  "destination": "_inbox/123e4567-e89b-42d3-a456-426614174002.json",
  "domain_assertion": {
    "digest": "dddddddddddddddddddddddddddddddddddddddddddddddddddddddddddddddd",
    "claim_candidate": "A synthetic event occurred for contract verification.",
    "decision_ref": "decisions/synthetic-domain-event-review-v1",
    "classification": "internal",
    "classification_policy_refs": ["policies/synthetic-retention-v1"]
  }
}
